{
  "id": "bo-xao-hanh-tay",
  "name": "Bò xào hành tây",
  "slot": "man",
  "regions": [
    "south",
    "north"
  ],
  "seasons": [
    "all"
  ],
  "spicy": "none",
  "cookingMethod": "xao",
  "proteinSource": "bo",
  "serveHot": true,
  "ingredients": [
    {
      "ingredientId": "thit-bo",
      "gramsEdiblePerServing": 80,
      "scale": "linear",
      "consumedRatio": 1,
      "note": "thái mỏng ngang thớ"
    },
    {
      "ingredientId": "hanh-tay",
      "gramsEdiblePerServing": 50,
      "scale": "linear",
      "consumedRatio": 1,
      "note": "thái múi cau"
    },
    {
      "ingredientId": "toi",
      "gramsEdiblePerServing": 3,
      "scale": "sublinear",
      "consumedRatio": 1,
      "note": "băm"
    },
    {
      "ingredientId": "nuoc-mam",
      "gramsEdiblePerServing": 5,
      "scale": "sublinear",
      "consumedRatio": 1,
      "note": null
    },
    {
      "ingredientId": "duong",
      "gramsEdiblePerServing": 2,
      "scale": "sublinear",
      "consumedRatio": 1,
      "note": null
    },
    {
      "ingredientId": "hat-tieu",
      "gramsEdiblePerServing": 0.3,
      "scale": "sublinear",
      "consumedRatio": 1,
      "note": null
    },
    {
      "ingredientId": "dau-an",
      "gramsEdiblePerServing": 6,
      "scale": "sublinear",
      "consumedRatio": 1,
      "note": null
    }
  ],
  "steps": [
    {
      "order": 1,
      "text": "Thái bò mỏng, ướp với tỏi, nước mắm, đường và tiêu.",
      "activeMinutes": 8,
      "passiveMinutes": 15,
      "ingredientIds": [
        "thit-bo",
        "toi",
        "nuoc-mam",
        "duong",
        "hat-tieu"
      ]
    },
    {
      "order": 2,
      "text": "Thái hành tây múi cau.",
      "activeMinutes": 3,
      "passiveMinutes": 0,
      "ingredientIds": [
        "hanh-tay"
      ]
    },
    {
      "order": 3,
      "text": "Xào bò lửa lớn đến khi chín tái, cho hành tây vào đảo nhanh.",
      "activeMinutes": 6,
      "passiveMinutes": 0,
      "ingredientIds": [
        "dau-an",
        "thit-bo",
        "hanh-tay"
      ]
    }
  ],
  "status": "draft",
  "provenance": {
    "draftedBy": "llm",
    "reviewedBy": null,
    "reviewedAt": null,
    "cookTestedAt": null,
    "measuredTotalMinutes": null
  },
  "image": {
    "thumb": null,
    "full": null,
    "source": null,
    "license": null,
    "isIllustration": false
  }
}
