{
  "id": "trung-chien-hanh",
  "name": "Trứng chiên hành",
  "slot": "man",
  "regions": [
    "north",
    "central",
    "south"
  ],
  "seasons": [
    "all"
  ],
  "spicy": "none",
  "cookingMethod": "chien",
  "proteinSource": "trung",
  "serveHot": true,
  "ingredients": [
    {
      "ingredientId": "trung-ga",
      "gramsEdiblePerServing": 55,
      "scale": "integer",
      "consumedRatio": 1,
      "note": null
    },
    {
      "ingredientId": "hanh-la",
      "gramsEdiblePerServing": 8,
      "scale": "fixed",
      "consumedRatio": 1,
      "note": "thái nhỏ"
    },
    {
      "ingredientId": "nuoc-mam",
      "gramsEdiblePerServing": 3,
      "scale": "sublinear",
      "consumedRatio": 1,
      "note": null
    },
    {
      "ingredientId": "hat-tieu",
      "gramsEdiblePerServing": 0.2,
      "scale": "sublinear",
      "consumedRatio": 1,
      "note": null
    },
    {
      "ingredientId": "dau-an",
      "gramsEdiblePerServing": 6,
      "scale": "sublinear",
      "consumedRatio": 1,
      "note": null
    }
  ],
  "steps": [
    {
      "order": 1,
      "text": "Đánh trứng với hành lá, nước mắm và tiêu.",
      "activeMinutes": 4,
      "passiveMinutes": 0,
      "ingredientIds": [
        "trung-ga",
        "hanh-la",
        "nuoc-mam",
        "hat-tieu"
      ]
    },
    {
      "order": 2,
      "text": "Chiên trứng với dầu nóng đến khi vàng hai mặt.",
      "activeMinutes": 5,
      "passiveMinutes": 0,
      "ingredientIds": [
        "dau-an",
        "trung-ga"
      ]
    }
  ],
  "status": "draft",
  "provenance": {
    "draftedBy": "llm",
    "reviewedBy": null,
    "reviewedAt": null,
    "cookTestedAt": null,
    "measuredTotalMinutes": null
  },
  "image": {
    "thumb": null,
    "full": null,
    "source": null,
    "license": null,
    "isIllustration": false
  }
}
