{
  "id": "canh-cai-ngot-nau-thit-bam",
  "name": "Canh cải ngọt nấu thịt bằm",
  "slot": "canh",
  "regions": [],
  "seasons": [
    "all"
  ],
  "spicy": "none",
  "cookingMethod": "nau",
  "proteinSource": "heo",
  "serveHot": false,
  "ingredients": [
    {
      "ingredientId": "thit-nac-bam",
      "gramsEdiblePerServing": 40,
      "scale": "linear",
      "consumedRatio": 1,
      "note": "băm nhỏ"
    },
    {
      "ingredientId": "hanh-tim",
      "gramsEdiblePerServing": 5,
      "scale": "sublinear",
      "consumedRatio": 1,
      "note": "bóc vỏ, băm nhỏ"
    },
    {
      "ingredientId": "dau-an",
      "gramsEdiblePerServing": 4,
      "scale": "sublinear",
      "consumedRatio": 1,
      "note": null
    },
    {
      "ingredientId": "nuoc-mam",
      "gramsEdiblePerServing": 8,
      "scale": "sublinear",
      "consumedRatio": 1,
      "note": "chia làm hai lần: ướp thịt và nêm canh"
    },
    {
      "ingredientId": "muoi",
      "gramsEdiblePerServing": 1,
      "scale": "sublinear",
      "consumedRatio": 1,
      "note": null
    },
    {
      "ingredientId": "hat-tieu",
      "gramsEdiblePerServing": 0.3,
      "scale": "sublinear",
      "consumedRatio": 1,
      "note": "xay"
    },
    {
      "ingredientId": "hanh-la",
      "gramsEdiblePerServing": 5,
      "scale": "fixed",
      "consumedRatio": 1,
      "note": "thái nhỏ"
    }
  ],
  "steps": [
    {
      "order": 1,
      "text": "Nhặt rửa cải ngọt rồi cắt khúc, bóc và băm hành tím, thái nhỏ hành lá.",
      "activeMinutes": 6,
      "passiveMinutes": 0,
      "ingredientIds": [
        "hanh-tim",
        "hanh-la"
      ]
    },
    {
      "order": 2,
      "text": "Ướp thịt bằm với một ít nước mắm và hạt tiêu.",
      "activeMinutes": 2,
      "passiveMinutes": 10,
      "ingredientIds": [
        "thit-nac-bam",
        "nuoc-mam",
        "hat-tieu"
      ]
    },
    {
      "order": 3,
      "text": "Phi thơm hành tím với dầu ăn rồi cho thịt vào đảo tơi đến khi săn lại.",
      "activeMinutes": 3,
      "passiveMinutes": 0,
      "ingredientIds": [
        "dau-an",
        "hanh-tim",
        "thit-nac-bam"
      ]
    },
    {
      "order": 4,
      "text": "Đổ nước vào nồi, đun sôi và hớt bọt cho nước trong.",
      "activeMinutes": 2,
      "passiveMinutes": 5,
      "ingredientIds": [
        "thit-nac-bam"
      ]
    },
    {
      "order": 5,
      "text": "Cho cải ngọt vào, nêm muối và phần nước mắm còn lại, đun sôi lại khoảng ba phút.",
      "activeMinutes": 2,
      "passiveMinutes": 3,
      "ingredientIds": [
        "muoi",
        "nuoc-mam"
      ]
    },
    {
      "order": 6,
      "text": "Tắt bếp, rắc hành lá và chút hạt tiêu rồi múc ra tô.",
      "activeMinutes": 1,
      "passiveMinutes": 0,
      "ingredientIds": [
        "hanh-la",
        "hat-tieu"
      ]
    }
  ],
  "status": "reviewed",
  "provenance": {
    "draftedBy": "llm",
    "reviewedBy": "Hoang Thong",
    "reviewedAt": "2026-10-20",
    "cookTestedAt": null,
    "measuredTotalMinutes": null
  },
  "image": {
    "thumb": null,
    "full": null,
    "source": null,
    "license": null,
    "isIllustration": false
  }
}
