{
  "id": "canh-rau-cu-thap-cam",
  "name": "Canh rau củ",
  "slot": "canh",
  "regions": [
    "north",
    "central",
    "south"
  ],
  "seasons": [
    "autumn",
    "winter"
  ],
  "spicy": "none",
  "cookingMethod": "nau",
  "proteinSource": "none",
  "serveHot": false,
  "ingredients": [
    {
      "ingredientId": "su-su",
      "gramsEdiblePerServing": 50,
      "scale": "linear",
      "consumedRatio": 1,
      "note": "gọt vỏ, cắt miếng"
    },
    {
      "ingredientId": "ca-rot",
      "gramsEdiblePerServing": 30,
      "scale": "linear",
      "consumedRatio": 1,
      "note": "cắt miếng"
    },
    {
      "ingredientId": "bap-cai",
      "gramsEdiblePerServing": 30,
      "scale": "linear",
      "consumedRatio": 1,
      "note": "xé nhỏ"
    },
    {
      "ingredientId": "hanh-tim",
      "gramsEdiblePerServing": 3,
      "scale": "sublinear",
      "consumedRatio": 1,
      "note": null
    },
    {
      "ingredientId": "nuoc-mam",
      "gramsEdiblePerServing": 4,
      "scale": "sublinear",
      "consumedRatio": 1,
      "note": null
    },
    {
      "ingredientId": "muoi",
      "gramsEdiblePerServing": 1,
      "scale": "sublinear",
      "consumedRatio": 1,
      "note": null
    },
    {
      "ingredientId": "hat-tieu",
      "gramsEdiblePerServing": 0.3,
      "scale": "sublinear",
      "consumedRatio": 1,
      "note": null
    }
  ],
  "steps": [
    {
      "order": 1,
      "text": "Gọt và cắt su su, cà rốt thành miếng vừa ăn; xé nhỏ bắp cải.",
      "activeMinutes": 10,
      "passiveMinutes": 0,
      "ingredientIds": [
        "su-su",
        "ca-rot",
        "bap-cai"
      ]
    },
    {
      "order": 2,
      "text": "Phi thơm hành tím, đổ nước và cho su su, cà rốt vào nấu mềm.",
      "activeMinutes": 3,
      "passiveMinutes": 15,
      "ingredientIds": [
        "hanh-tim",
        "su-su",
        "ca-rot"
      ]
    },
    {
      "order": 3,
      "text": "Cho bắp cải vào, nêm nước mắm, muối, tiêu.",
      "activeMinutes": 2,
      "passiveMinutes": 5,
      "ingredientIds": [
        "bap-cai",
        "nuoc-mam",
        "muoi",
        "hat-tieu"
      ]
    }
  ],
  "status": "draft",
  "provenance": {
    "draftedBy": "llm",
    "reviewedBy": null,
    "reviewedAt": null,
    "cookTestedAt": null,
    "measuredTotalMinutes": null
  },
  "image": {
    "thumb": null,
    "full": null,
    "source": null,
    "license": null,
    "isIllustration": false
  }
}
