{
  "id": "canh-nam-dau-phu",
  "name": "Canh nấm đậu phụ",
  "slot": "canh",
  "regions": [
    "central",
    "south"
  ],
  "seasons": [
    "all"
  ],
  "spicy": "none",
  "cookingMethod": "nau",
  "proteinSource": "chay",
  "serveHot": false,
  "ingredients": [
    {
      "ingredientId": "nam-rom",
      "gramsEdiblePerServing": 40,
      "scale": "linear",
      "consumedRatio": 1,
      "note": "cắt đôi"
    },
    {
      "ingredientId": "dau-phu",
      "gramsEdiblePerServing": 50,
      "scale": "linear",
      "consumedRatio": 1,
      "note": "cắt hạt lựu"
    },
    {
      "ingredientId": "ca-rot",
      "gramsEdiblePerServing": 20,
      "scale": "linear",
      "consumedRatio": 1,
      "note": "thái sợi"
    },
    {
      "ingredientId": "hanh-la",
      "gramsEdiblePerServing": 5,
      "scale": "fixed",
      "consumedRatio": 1,
      "note": "thái nhỏ"
    },
    {
      "ingredientId": "nuoc-mam",
      "gramsEdiblePerServing": 4,
      "scale": "sublinear",
      "consumedRatio": 1,
      "note": null
    },
    {
      "ingredientId": "muoi",
      "gramsEdiblePerServing": 1,
      "scale": "sublinear",
      "consumedRatio": 1,
      "note": null
    }
  ],
  "steps": [
    {
      "order": 1,
      "text": "Rửa nấm, cắt đôi; cắt đậu phụ hạt lựu; cà rốt thái sợi.",
      "activeMinutes": 8,
      "passiveMinutes": 0,
      "ingredientIds": [
        "nam-rom",
        "dau-phu",
        "ca-rot"
      ]
    },
    {
      "order": 2,
      "text": "Đun sôi nước, cho cà rốt và nấm vào nấu chín.",
      "activeMinutes": 2,
      "passiveMinutes": 8,
      "ingredientIds": [
        "ca-rot",
        "nam-rom"
      ]
    },
    {
      "order": 3,
      "text": "Thêm đậu phụ, nêm nước mắm và muối, rắc hành lá.",
      "activeMinutes": 2,
      "passiveMinutes": 3,
      "ingredientIds": [
        "dau-phu",
        "nuoc-mam",
        "muoi",
        "hanh-la"
      ]
    }
  ],
  "status": "draft",
  "provenance": {
    "draftedBy": "llm",
    "reviewedBy": null,
    "reviewedAt": null,
    "cookTestedAt": null,
    "measuredTotalMinutes": null
  },
  "image": {
    "thumb": null,
    "full": null,
    "source": null,
    "license": null,
    "isIllustration": false
  }
}
