{
  "id": "tom-rim-man-ngot",
  "name": "Tôm rim mặn ngọt",
  "slot": "man",
  "regions": [
    "south",
    "central"
  ],
  "seasons": [
    "all"
  ],
  "spicy": "optional",
  "cookingMethod": "kho",
  "proteinSource": "tom",
  "serveHot": false,
  "ingredients": [
    {
      "ingredientId": "tom",
      "gramsEdiblePerServing": 70,
      "scale": "linear",
      "consumedRatio": 1,
      "note": "để nguyên vỏ, cắt râu"
    },
    {
      "ingredientId": "hanh-tim",
      "gramsEdiblePerServing": 4,
      "scale": "sublinear",
      "consumedRatio": 1,
      "note": null
    },
    {
      "ingredientId": "ot",
      "gramsEdiblePerServing": 2,
      "scale": "sublinear",
      "consumedRatio": 1,
      "note": "tuỳ khẩu vị"
    },
    {
      "ingredientId": "nuoc-mam",
      "gramsEdiblePerServing": 6,
      "scale": "sublinear",
      "consumedRatio": 1,
      "note": null
    },
    {
      "ingredientId": "duong",
      "gramsEdiblePerServing": 5,
      "scale": "sublinear",
      "consumedRatio": 1,
      "note": null
    },
    {
      "ingredientId": "dau-an",
      "gramsEdiblePerServing": 3,
      "scale": "sublinear",
      "consumedRatio": 1,
      "note": null
    }
  ],
  "steps": [
    {
      "order": 1,
      "text": "Rửa tôm, cắt râu, để ráo.",
      "activeMinutes": 5,
      "passiveMinutes": 0,
      "ingredientIds": [
        "tom"
      ]
    },
    {
      "order": 2,
      "text": "Phi thơm hành tím, cho tôm vào xào đến khi đổi màu.",
      "activeMinutes": 4,
      "passiveMinutes": 0,
      "ingredientIds": [
        "hanh-tim",
        "dau-an",
        "tom"
      ]
    },
    {
      "order": 3,
      "text": "Thêm nước mắm, đường và ớt, rim nhỏ lửa đến khi sệt.",
      "activeMinutes": 3,
      "passiveMinutes": 8,
      "ingredientIds": [
        "nuoc-mam",
        "duong",
        "ot",
        "tom"
      ]
    }
  ],
  "status": "draft",
  "provenance": {
    "draftedBy": "llm",
    "reviewedBy": null,
    "reviewedAt": null,
    "cookTestedAt": null,
    "measuredTotalMinutes": null
  },
  "image": {
    "thumb": null,
    "full": null,
    "source": null,
    "license": null,
    "isIllustration": false
  }
}
